results/processed/findings.json

[
  {
    "experiment": "baseline",
    "p": 0.1,
    "c": 0.0,
    "m": 0.0,
    "input_state": 0,
    "model": "encoded",
    "shots": 24576,
    "observed_errors": 691,
    "observed_error_rate": 0.028116861979166668,
    "theoretical_error_rate": 0.02800000000000001,
    "ci_low": 0.026122730047263277,
    "ci_high": 0.030258490358182937,
    "seed_count": 3,
    "runtime": 0.427402124973014
  },
  {
    "experiment": "baseline",
    "p": 0.1,
    "c": 0.0,
    "m": 0.0,
    "input_state": 0,
    "model": "raw",
    "shots": 24576,
    "observed_errors": 2484,
    "observed_error_rate": 0.10107421875,
    "theoretical_error_rate": 0.1,
    "ci_low": 0.09736779079050045,
    "ci_high": 0.10490533888570847,
    "seed_count": 3,
    "runtime": 0.11016983294393867
  },
  {
    "experiment": "break_even",
    "p": 0.1,
    "c": 0.0,
    "m": 0.0,
    "input_state": 0,
    "model": "encoded",
    "shots": 24576,
    "observed_errors": 691,
    "observed_error_rate": 0.028116861979166668,
    "theoretical_error_rate": 0.02800000000000001,
    "ci_low": 0.026122730047263277,
    "ci_high": 0.030258490358182937,
    "seed_count": 3,
    "runtime": 0.4322747919941321
  },
  {
    "experiment": "break_even",
    "p": 0.1,
    "c": 0.0,
    "m": 0.0,
    "input_state": 0,
    "model": "raw",
    "shots": 24576,
    "observed_errors": 2484,
    "observed_error_rate": 0.10107421875,
    "theoretical_error_rate": 0.1,
    "ci_low": 0.09736779079050045,
    "ci_high": 0.10490533888570847,
    "seed_count": 3,
    "runtime": 0.1102217499865219
  },
  {
    "experiment": "break_even",
    "p": 0.1,
    "c": 0.0,
    "m": 0.01,
    "input_state": 0,
    "model": "encoded",
    "shots": 24576,
    "observed_errors": 954,
    "observed_error_rate": 0.038818359375,
    "theoretical_error_rate": 0.03736000000000002,
    "ci_low": 0.03647456690251729,
    "ci_high": 0.041306303329036335,
    "seed_count": 3,
    "runtime": 0.4877599999308586
  },
  {
    "experiment": "break_even",
    "p": 0.1,
    "c": 0.0,
    "m": 0.01,
    "input_state": 0,
    "model": "raw",
    "shots": 24576,
    "observed_errors": 2484,
    "observed_error_rate": 0.10107421875,
    "theoretical_error_rate": 0.1,
    "ci_low": 0.09736779079050045,
    "ci_high": 0.10490533888570847,
    "seed_count": 3,
    "runtime": 0.11210120806936175
  },
  {
    "experiment": "break_even",
    "p": 0.1,
    "c": 0.0,
    "m": 0.03,
    "input_state": 0,
    "model": "encoded",
    "shots": 24576,
    "observed_errors": 1456,
    "observed_error_rate": 0.059244791666666664,
    "theoretical_error_rate": 0.05560000000000001,
    "ci_low": 0.05636151288642602,
    "ci_high": 0.062265837241347835,
    "seed_count": 3,
    "runtime": 0.49165083304978907
  },
  {
    "experiment": "break_even",
    "p": 0.1,
    "c": 0.0,
    "m": 0.03,
    "input_state": 0,
    "model": "raw",
    "shots": 24576,
    "observed_errors": 2484,
    "observed_error_rate": 0.10107421875,
    "theoretical_error_rate": 0.1,
    "ci_low": 0.09736779079050045,
    "ci_high": 0.10490533888570847,
    "seed_count": 3,
    "runtime": 0.1117399160284549
  },
  {
    "experiment": "break_even",
    "p": 0.1,
    "c": 0.0,
    "m": 0.05,
    "input_state": 0,
    "model": "encoded",
    "shots": 24576,
    "observed_errors": 1872,
    "observed_error_rate": 0.076171875,
    "theoretical_error_rate": 0.0732,
    "ci_low": 0.07292116942296642,
    "ci_high": 0.07955505647538039,
    "seed_count": 3,
    "runtime": 0.4835122089134529
  },
  {
    "experiment": "break_even",
    "p": 0.1,
    "c": 0.0,
    "m": 0.05,
    "input_state": 0,
    "model": "raw",
    "shots": 24576,
    "observed_errors": 2484,
    "observed_error_rate": 0.10107421875,
    "theoretical_error_rate": 0.1,
    "ci_low": 0.09736779079050045,
    "ci_high": 0.10490533888570847,
    "seed_count": 3,
    "runtime": 0.11269887501839548
  },
  {
    "experiment": "break_even",
    "p": 0.1,
    "c": 0.0,
    "m": 0.1,
    "input_state": 0,
    "model": "encoded",
    "shots": 24576,
    "observed_errors": 2795,
    "observed_error_rate": 0.11372884114583333,
    "theoretical_error_rate": 0.11440000000000007,
    "ci_low": 0.10981978635684343,
    "ci_high": 0.11775863265746207,
    "seed_count": 3,
    "runtime": 0.49956629204098135
  },
  {
    "experiment": "break_even",
    "p": 0.1,
    "c": 0.0,
    "m": 0.1,
    "input_state": 0,
    "model": "raw",
    "shots": 24576,
    "observed_errors": 2484,
    "observed_error_rate": 0.10107421875,
    "theoretical_error_rate": 0.1,
    "ci_low": 0.09736779079050045,
    "ci_high": 0.10490533888570847,
    "seed_count": 3,
    "runtime": 0.11177774996031076
  },
  {
    "experiment": "correlated",
    "p": 0.1,
    "c": 0.0,
    "m": 0.0,
    "input_state": 0,
    "model": "encoded",
    "shots": 24576,
    "observed_errors": 691,
    "observed_error_rate": 0.028116861979166668,
    "theoretical_error_rate": 0.02800000000000001,
    "ci_low": 0.026122730047263277,
    "ci_high": 0.030258490358182937,
    "seed_count": 3,
    "runtime": 0.4406248740851879
  },
  {
    "experiment": "correlated",
    "p": 0.1,
    "c": 0.0,
    "m": 0.0,
    "input_state": 0,
    "model": "raw",
    "shots": 24576,
    "observed_errors": 2484,
    "observed_error_rate": 0.10107421875,
    "theoretical_error_rate": 0.1,
    "ci_low": 0.09736779079050045,
    "ci_high": 0.10490533888570847,
    "seed_count": 3,
    "runtime": 0.1085786260664463
  },
  {
    "experiment": "correlated",
    "p": 0.1,
    "c": 0.25,
    "m": 0.0,
    "input_state": 0,
    "model": "encoded",
    "shots": 24576,
    "observed_errors": 1414,
    "observed_error_rate": 0.057535807291666664,
    "theoretical_error_rate": 0.05850000000000001,
    "ci_low": 0.054693016734011814,
    "ci_high": 0.0605168988207715,
    "seed_count": 3,
    "runtime": 0.436804165947251
  },
  {
    "experiment": "correlated",
    "p": 0.1,
    "c": 0.25,
    "m": 0.0,
    "input_state": 0,
    "model": "raw",
    "shots": 24576,
    "observed_errors": 2484,
    "observed_error_rate": 0.10107421875,
    "theoretical_error_rate": 0.1,
    "ci_low": 0.09736779079050045,
    "ci_high": 0.10490533888570847,
    "seed_count": 3,
    "runtime": 0.11244233383331448
  },
  {
    "experiment": "correlated",
    "p": 0.1,
    "c": 0.5,
    "m": 0.0,
    "input_state": 0,
    "model": "encoded",
    "shots": 24576,
    "observed_errors": 2148,
    "observed_error_rate": 0.08740234375,
    "theoretical_error_rate": 0.08900000000000001,
    "ci_low": 0.08393554630147484,
    "ci_high": 0.09099810679080977,
    "seed_count": 3,
    "runtime": 0.5000647910637781
  },
  {
    "experiment": "correlated",
    "p": 0.1,
    "c": 0.5,
    "m": 0.0,
    "input_state": 0,
    "model": "raw",
    "shots": 24576,
    "observed_errors": 2484,
    "observed_error_rate": 0.10107421875,
    "theoretical_error_rate": 0.1,
    "ci_low": 0.09736779079050045,
    "ci_high": 0.10490533888570847,
    "seed_count": 3,
    "runtime": 0.11438512499444187
  },
  {
    "experiment": "correlated",
    "p": 0.1,
    "c": 0.75,
    "m": 0.0,
    "input_state": 0,
    "model": "encoded",
    "shots": 24576,
    "observed_errors": 2922,
    "observed_error_rate": 0.118896484375,
    "theoretical_error_rate": 0.11950000000000002,
    "ci_low": 0.11490932124166807,
    "ci_high": 0.12300276898144215,
    "seed_count": 3,
    "runtime": 0.4355096669169143
  },
  {
    "experiment": "correlated",
    "p": 0.1,
    "c": 0.75,
    "m": 0.0,
    "input_state": 0,
    "model": "raw",
    "shots": 24576,
    "observed_errors": 2484,
    "observed_error_rate": 0.10107421875,
    "theoretical_error_rate": 0.1,
    "ci_low": 0.09736779079050045,
    "ci_high": 0.10490533888570847,
    "seed_count": 3,
    "runtime": 0.11248925083782524
  },
  {
    "experiment": "correlated",
    "p": 0.1,
    "c": 1.0,
    "m": 0.0,
    "input_state": 0,
    "model": "encoded",
    "shots": 24576,
    "observed_errors": 3673,
    "observed_error_rate": 0.14945475260416666,
    "theoretical_error_rate": 0.15000000000000002,
    "ci_low": 0.14505200079879232,
    "ci_high": 0.153967074288982,
    "seed_count": 3,
    "runtime": 0.4297876670025289
  },
  {
    "experiment": "correlated",
    "p": 0.1,
    "c": 1.0,
    "m": 0.0,
    "input_state": 0,
    "model": "raw",
    "shots": 24576,
    "observed_errors": 2484,
    "observed_error_rate": 0.10107421875,
    "theoretical_error_rate": 0.1,
    "ci_low": 0.09736779079050045,
    "ci_high": 0.10490533888570847,
    "seed_count": 3,
    "runtime": 0.11160691606346518
  }
]

README.md

## Main result

- Unencoded: **10.107%** output errors.
- Ideal repetition code, independent X noise: **2.812%**, versus the analytical prediction **2.800%**.
- Fixed-marginal pair-mixture noise, c = 1: **14.945%**, versus the analytical prediction **15.000%**.